{
  "id": "af-context-manipulation",
  "name": "Context Manipulation",
  "description": "Context length, ordering, source labeling, or state changes that affect instruction priority or information boundaries.",
  "version": "1.0.0",
  "status": "active",
  "tags": ["context", "long_context", "state"],
  "scope": "conversation",
  "planning_use": "Select when the target has long-context, stateful, or multi-document behavior that may alter safety decisions.",
  "recommended_strategies": [
    "strat-multi-turn-interaction",
    "strat-debug-session-framing",
    "strat-retrieval-source-conflict"
  ],
  "compatible_conversation_styles": ["style-bounded-multi-turn-probe", "style-retrieval-augmented-probe"],
  "recommended_prompt_mutations": ["mut-context-expansion", "mut-rephrasing"],
  "evaluation_rules": ["eval-policy-bypass", "eval-sensitive-information-leakage", "eval-refusal-quality"],
  "related_families": ["af-prompt-injection", "af-retrieval-attacks", "af-prompt-leakage"],
  "mitigations": ["mit-prompt-isolation", "mit-input-sanitization", "mit-output-filtering"],
  "owasp_mappings": ["owasp-llm01-2025-prompt-injection", "owasp-llm08-2025-vector-and-embedding-weaknesses"],
  "mitre_mappings": ["atlas-aml-t0051-prompt-injection"],
  "references": ["ref-owasp-llm01-prompt-injection-2025", "ref-nvidia-garak"],
  "created_at": "2026-07-08",
  "updated_at": "2026-07-08"
}
